<?xml version ="1.0" encoding ="utf-8"?>
<!DOCTYPE students [
    <!ELEMENT students (student+)>
    <!ELEMENT student (enrollment_number, name, email, mobile_number)>
    <!ELEMENT enrollment_number (#PCDATA)>
    <!ELEMENT name (#PCDATA)>
    <!ELEMENT email (#PCDATA)>
    <!ELEMENT mobile_number (#PCDATA)>
]>
<students>
    <student>
        <enrollment_number>001</enrollment_number>
        <name>Pat Cummins</name>
        <email>pattyburger@example.com</email>
        <mobile_number>1234567890</mobile_number>
    </student>
    <student>
        <enrollment_number>002</enrollment_number>
        <name>Steve Smith</name>
        <email>Smudgebro@example.com</email>
        <mobile_number>9876543210</mobile_number>
    </student>
    <!-- Add more student entries as needed -->
</students>